{
  "id": "zhang-yeung-averaged-scaled",
  "label": "Zhang-Yeung averaged inequality (scaled by 4)",
  "variable_count": 4,
  "basis": "joint_entropy",
  "terms": [
    {
      "subset": [
        0
      ],
      "coefficient": "1"
    },
    {
      "subset": [
        1
      ],
      "coefficient": "1"
    },
    {
      "subset": [
        2
      ],
      "coefficient": "4"
    },
    {
      "subset": [
        3
      ],
      "coefficient": "4"
    },
    {
      "subset": [
        0,
        1
      ],
      "coefficient": "2"
    },
    {
      "subset": [
        0,
        2
      ],
      "coefficient": "-4"
    },
    {
      "subset": [
        0,
        3
      ],
      "coefficient": "-4"
    },
    {
      "subset": [
        1,
        2
      ],
      "coefficient": "-4"
    },
    {
      "subset": [
        1,
        3
      ],
      "coefficient": "-4"
    },
    {
      "subset": [
        2,
        3
      ],
      "coefficient": "-6"
    },
    {
      "subset": [
        0,
        2,
        3
      ],
      "coefficient": "5"
    },
    {
      "subset": [
        1,
        2,
        3
      ],
      "coefficient": "5"
    }
  ],
  "provenance": {
    "source": "Zhang and Yeung (1998), eq. 23",
    "note": "Reference fixture imported during bootstrap from the sibling formalization project."
  },
  "copy_parameters_ref": null,
  "symmetry_orbit_size": null,
  "status": "reference"
}
